{
    "rating": 78,
    "project": "The poem chronicles a single evening and morning of communal living, using precise domestic details to map the rhythm of shared meals, conversation, and quiet intimacy among friends in an urban apartment.",
    "themes": [
        "community",
        "domestic_life",
        "intimacy"
    ],
    "moods": [
        "tender",
        "communal"
    ],
    "poetic_forms": [
        "lyric"
    ],
    "techniques": [
        "catalogue",
        "indentation_as_structure",
        "parataxis",
        "short_declarative_lines"
    ],
    "tones_voices": [
        "plainspoken",
        "documentary"
    ],
    "key_images": [
        "shared flat nine storeys up",
        "porch facing south",
        "Brisbane River",
        "Mount Barney",
        "kitchen guests",
        "Tom Waits on portable speakers",
        "washing vegetables",
        "Thai curry chicken",
        "yellow candlelight",
        "Victoria Bridge",
        "French press coffee"
    ],
    "contest_fit": [
        "friendship",
        "urban life",
        "domestic scenes",
        "Australian setting",
        "young adults",
        "hospitality"
    ],
    "id": "2fc1c84b-3e65-4788-abaf-333205e709e6",
    "title": "Just Enough Freedom",
    "author": {
        "pen_name": "JoJo",
        "full_name": "John Wagner"
    },
    "url": "https://allpoetry.com/poem/18872799",
    "body": "A shared flat,\nnine storeys up,\nwith a view of the city.\n\nThe porch faces south—\n    the Scenic Rim on the horizon,\n    city streets close by,\n    blocks of flats, a park,\n    the Brisbane River between,\n        close enough to touch;\n    no morning sun,\n        but a couch,\n        cushioned seats,\n        and a coffee table—\n            a porch built for six.\n\n\nBut the city is quiet, still—\nno cars, no motion, no sound\n    rising from the street,\nlights in flats flickering\nas people carry on\n    with their evening.\n\nWe stay where we are.\n\n\nGuests gather again in the kitchen—\na couple visiting from Adelaide,\ntwo Sydney students on break,\nthe host puts Tom Waits\non portable speakers.\n\nWe wash vegetables, rinse rice,\nopen cans of bamboo shoots,\ndice fresh chicken thighs.\nSome cook, others put out\nplates, chopsticks, forks,\nand knives.\n\nGlasses are set on the bench.\nWine is opened, sodas and beers.\n\nThrough the kitchen window,\nlights still flicker in flats,\nutes remain parked,\nMount Barney holds.\n\n\nWe finish, plate, and take our meals\nto the porch, arrange, rearrange.\nThe couch is full of conversation.\nThose in chairs laugh. Wine is poured.\nI teach a student how to use chopsticks.\n\nThai curry chicken on rice.\nA Margaret River cabernet.\nGarlic butter naan.\n\nYellow candlelight replaces\nthe white of incandescent bulbs.\n\n\nI carry plates to the kitchen.\nSteve puts on Courtney Barnett.\nAnne reaches for someone’s hand.\n\nThey all dance.\nI wash.\nClaire dries.\n\n\nOutside, Victoria Bridge is empty.\nClaire takes more wine and we join.\nCourtney is replaced by The National.\n    We sing and dance.\nAnne and I head for the porch. We smoke.\nLoud music fails to disturb the city.\n\nWe go back in. I dance with Claire.\nNight turns to morning.\nMorning leads to bed.\n\nWe wake late.\nPress coffee on the porch.\nSlice bread.\nArrange, rearrange sliced devon.\n\nBelow us the cars start to move.\nStreet life reaches us again.\nVictoria Bridge is no longer empty.\nMount Cordeaux is close enough to touch.\n\nThe city moves again.\n\n\nWe stand, take\n    our French press,\n    coffee cups,\n    light cream\n        to the kitchen\n            and begin to cook. ",
    "awards": [],
    "socials": [
        "https://www.instagram.com/p/DWSzr9DDWf1/"
    ],
    "date": "2026-01-09T23:43:00Z",
    "lines": 78,
    "words": 353,
    "notes": [
        "The porch looks south from a ninth-floor Brisbane flat, with Mount Barney and the Scenic Rim visible beyond the river. Friends gather for an evening that stretches into morning, cooking and sharing meals while the city below stays unusually quiet. The stillness outside mirrors the contained world they've created together, nine storeys up."
    ]
}