{
    "rating": 88,
    "project": "The poem adopts the perspective of cancerous cells describing their growth and spread through a body, presenting malignancy as a neutral process of expansion without moral judgment.",
    "themes": [
        "biological_process",
        "cancer",
        "control"
    ],
    "moods": [
        "clinical",
        "ominous"
    ],
    "poetic_forms": [
        "lyric"
    ],
    "techniques": [
        "short_declarative_lines",
        "anaphora",
        "parallelism"
    ],
    "tones_voices": [
        "clinical",
        "detached"
    ],
    "key_images": [
        "corridors of red",
        "iron wash",
        "yielding walls",
        "bright pulses",
        "cooled rooms",
        "slowed rivers",
        "forgotten boundaries"
    ],
    "contest_fit": [
        "medical",
        "biology",
        "illness",
        "perspective",
        "death"
    ],
    "id": "d0dc543f-6922-4e8d-9ebb-cbd562936fe0",
    "title": "Unchecked",
    "author": {
        "pen_name": "JoJo",
        "full_name": "John Wagner"
    },
    "url": "https://allpoetry.com/poem/19002938",
    "body": "I began as a softness\nin a place already full.\n\nThere was warmth,\na steady wash of iron,\ncorridors of red\nopening and closing\nwithout decision.\n\nI learned the walls by touch.\n\nThey yielded.\nThey tightened.\nThey thinned.\n\nWhere there was current,\nI followed it.\nWhere there was stillness,\nI pressed until it altered.\n\nDivision was not ambition.\nIt was repetition.\nA quiet doubling\nthat felt like continuity.\n\nThe larger body dimmed gradually.\n\nSignals that once arrived\nin bright pulses\ncame irregularly,\nthen not at all.\nThe rooms cooled.\nThe rivers slowed.\n\nI did not register alarm.\nOnly difference.\n\nSpace narrowed.\nThen widened strangely,\nas if boundaries had forgotten\ntheir instructions.\n\nAt the end,\nthere was no verdict.\n\nOnly the absence\nof resistance.\n\nI would have continued.",
    "awards": [],
    "socials": [],
    "date": "2026-03-20T03:06:00Z",
    "lines": 37,
    "words": 127,
    "notes": [
        "This is a voice from inside a body that is failing, speaking from within the very process that is causing that failure."
    ]
}