{
    "rating": 87,
    "project": "The poem tracks a moment of charged silence between two people, explicitly rejecting metaphorical language in favor of direct physical observation and psychological pressure.",
    "themes": [
        "desire",
        "intimacy",
        "language"
    ],
    "moods": [
        "restrained",
        "tender"
    ],
    "poetic_forms": [
        "lyric"
    ],
    "techniques": [
        "indentation_as_structure",
        "short_declarative_lines",
        "caesural_breaks",
        "direct_address"
    ],
    "tones_voices": [
        "intimate",
        "compressed"
    ],
    "key_images": [
        "kettle clicking off",
        "woman leaning in doorway",
        "faint knife scar on arm",
        "dust in sunlight",
        "knuckle tapping counter"
    ],
    "contest_fit": [
        "desire",
        "intimacy",
        "domestic moments",
        "silence",
        "attraction"
    ],
    "id": "f6077c31-23d0-4652-8249-e2f965406167",
    "title": "Not a Metaphor",
    "author": {
        "pen_name": "JoJo",
        "full_name": "John Wagner"
    },
    "url": "https://allpoetry.com/poem/18912395",
    "body": "I rehearse a line I think is clever\n    while the kettle clicks off.\n\nShe leans in the doorway\n    and clever dies first.\n\nMy breathing goes wrong.\nNot poetic-wrong—\n    asthma wrong, like misjudging\n        a staircase.\n\nHer arm rests on the counter.\nA faint knife scar.\nI don’t ask about it.\n    I track it.\n        Already ashamed.\n\nThe room begins to pair things:\n        her silence with my name,\n        the hum of the fridge with waiting.\n\nShe barely moves.\nNeither do I.\nThe space between us thickens,\n    visible as dust in sunlight.\n\nShe almost says something—\n    stops.\nThe almost\n        lands heavier.\n\nI think of a river and immediately hate myself.\nHer knuckle taps the counter twice.\n        Enough.\n\nWhat I expect to end\n    doesn’t.\nMy attention keeps sliding forward,\n    past manners,\n    past restraint.\n\nI am no longer deciding\n        what this is.\n\nI try, once more,\n    to make her stand\n        for anything else.\nShe exhales.\nThe idea collapses.\n\nNothing is crossed out.\nI stop reaching for language\n    and stay with the pressure of her presence,\n    unsymbolised,\n    unforgiving.\n    Close enough\n        that even silence\n            is contact.",
    "awards": [
        {
            "url": "https://allpoetry.com/contest/2889727",
            "medal": "Gold",
            "title": "Forty",
            "closed": "2026-03-07T05:32:21-08:00"
        },
        {
            "url": "https://allpoetry.com/contest/2889193",
            "medal": "Gold",
            "title": "Part Sinner Part Saint: Threshold",
            "closed": "2026-03-20T09:31:40-07:00"
        }
    ],
    "socials": [
        "https://www.instagram.com/p/DWR8JQtlJ3_/"
    ],
    "date": "2026-01-31T06:02:00Z",
    "lines": 47,
    "words": 178,
    "notes": [
        "The poem began as an argument with myself about what relationships are allowed to mean — and whether I was actually present, or already composing."
    ]
}