{
    "rating": 87,
    "project": "The poem constructs an architectural interior that functions as an anatomical metaphor, using precise structural details to map the hidden mechanisms and gradual deterioration of a living body.",
    "themes": [
        "biological_process",
        "control",
        "mortality"
    ],
    "moods": [
        "clinical",
        "ominous"
    ],
    "poetic_forms": [
        "lyric"
    ],
    "techniques": [
        "short_declarative_lines",
        "parallelism",
        "catalogue",
        "end_stopped_lines"
    ],
    "tones_voices": [
        "clinical",
        "restrained"
    ],
    "key_images": [
        "narrow corridor with damp walls",
        "steady drip",
        "pale load-bearing columns",
        "pressing ceiling",
        "thick slow air",
        "filtered thinned light",
        "shoulder-width alcoves",
        "soft yielding material",
        "pulsing pipes",
        "lifted floor beneath intact tile",
        "hairline fractures across plaster",
        "invisible straining beams"
    ],
    "contest_fit": [
        "architecture",
        "medical",
        "anatomy",
        "structural engineering",
        "aging",
        "infrastructure",
        "bodily systems"
    ],
    "id": "2e7e6cb5-172f-4fcf-b347-411be390e5d5",
    "title": "Load-Bearing Interior",
    "author": {
        "pen_name": "JoJo",
        "full_name": "John Wagner"
    },
    "url": "https://allpoetry.com/poem/19004401",
    "body": "It is not empty here.\n\nThe room begins in a narrow corridor,\nwalls close and damp,\nwhere a steady drip measures\nthe distance between surfaces.\n\nBeyond that,\nit opens.\n\nColumns rise without ornament,\npale and load-bearing,\nholding up a ceiling\nthat presses downward\nwithout ever touching.\n\nThe air is thick,\nslow to circulate.\nLight does not enter directly.\nIt filters through layers,\narriving thinned,\narriving altered,\nas if it had passed through\ntoo many hands.\n\nAlong the perimeter,\nthere are smaller chambers—\nalcoves no wider than a shoulder,\nlined in soft material\nthat gives\nand gives\nand does not recover.\n\nPipes run through the walls.\nSome pulse.\nSome have gone still.\nA faint current hums in the distance,\nirregular,\nthen absent.\n\nIn the center,\nthe floor has lifted slightly,\na quiet swelling\nbeneath intact tile.\nIt does not announce itself.\nIt simply changes the level\non which everything stands.\n\nThe ceiling adjusts in response.\nBeams strain invisibly.\nHairline fractures map themselves\nacross plaster,\nfine as capillaries.\n\nThere are no windows.\n\nIf there were,\nthey would look out\nonto another structure\npressing close,\nits weight leaning inward.\n\nThe room expands\nwhere it can.\nIt narrows\nwhere it must.\n\nNothing in it is decorative.\nEvery surface carries something.\n\nWhen the current stops entirely,\nthe air does not clear.\nThe columns remain upright.\nThe lifted floor does not settle.\n\nThe structure holds\nwhat it has made.",
    "awards": [
        {
            "url": "https://allpoetry.com/contest/2891112",
            "medal": "Gold",
            "title": "What Do You See?",
            "closed": "2026-03-30T01:22:04-07:00"
        }
    ],
    "socials": [
        "https://www.instagram.com/p/DWNc6CKjQDl/"
    ],
    "date": "2026-03-20T20:50:00Z",
    "lines": 63,
    "words": 233,
    "notes": [
        "This is architecture as anatomy, where corridors and chambers form the interior geography of a body under pressure. The load-bearing columns and swelling floor create a space that breathes without windows, pulses without decoration, and holds its weight through invisible strain."
    ]
}